"PatternId_decimal",description,"killchain_stage",name,objective,"pattern_updated",scenario,scenarioFriendly,severity,"show_in_ui",tactic,technique
0,"A process wrote an artifact indicative of reflective code loading",,"Reflective code loading","Keep Access","1698431229.0",,,0,False,"Defense Evasion","Reflective Code Loading"
1,"Productivity app wrote an executable to the filesystem",Exploitation,ProductivityAppExecutableWrite,"Gain Access","1698429517.0","malicious_document","Malicious document",10,False,"Initial Access","Spearphishing Attachment"
2,"Productivity app launched an executable",Exploitation,ProductivityAppExecutableLaunch,"Gain Access","1698430764.0","malicious_document","Malicious document",10,False,"Initial Access","Spearphishing Attachment"
3,"A productivity application launched in its own parent chain. Adversaries can use this to gain access to a system. Review the process tree.",Exploitation,ProductivityAppLaunchFromParent,"Gain Access","1698429517.0","malicious_document","Malicious document",10,False,"Initial Access","Spearphishing Attachment"
4,"Productivity app or one of its children wrote a registry key used for persistence",Exploitation,ProductivityAppAsepWrite,"Keep Access","1698429517.0","malicious_document","Malicious document",30,False,Persistence,"Registry Run Keys / Startup Folder"
5,"Command prompt in process subtree beneath a productivity application",Exploitation,ProductivityAppCmdLaunch,"Follow Through","1698430764.0","malicious_document","Malicious document",50,False,Execution,"Command and Scripting Interpreter"
6,"Browser renderer process wrote an executable to the filesystem",Exploitation,BrowserExecutableWrite,"Gain Access","1698429517.0","drive_by_download","Web exploit",50,False,"Initial Access","Drive-by Compromise"
7,"Remote thread injection from Chrome renderer process",Exploitation,ChromeInjectedThread,"Keep Access","1698430764.0","drive_by_download","Web exploit",50,False,"Defense Evasion","Process Injection"
8,"Browser renderer wrote a registry key used for persistence",Exploitation,BrowserRegWrite,"Keep Access","1698429517.0","drive_by_download","Web exploit",50,False,Persistence,"Registry Run Keys / Startup Folder"
9,"A web browser opened a command line interface. Adversaries often use this to execute malicious code. Review the process tree.",Exploitation,BrowserCmdLaunch,"Follow Through","1698430764.0","drive_by_download","Web exploit",50,False,Execution,"Exploitation for Client Execution"
10,"Known malware was executed.",Unknown,deprecated,,"1698430764.0","known_malware","Known malware",50,True,,
11,"Remote thread injection from IE renderer process",Exploitation,IEInjectedThread,"Keep Access","1698430764.0","drive_by_download","Web exploit",50,False,"Defense Evasion","Process Injection"
12,"A remote thread in LSASS accessed credential registry keys.","Lateral motion",LsassInjectedRegAccess,"Gain Access","1698429517.0","credential_theft","Credential theft",70,True,"Credential Access","OS Credential Dumping"
13,"A productivity application wrote and ran an executable.",Exploitation,ProductivityAppWriteExecute,"Follow Through","1698430764.0","malicious_document","Malicious document",50,False,Execution,"Exploitation for Client Execution"
14,"Lsass loaded an unsigned DLL. Adversaries often use this to steal credentials. If credentials were dumped, change your passwords and review the process tree.","Lateral motion",LsassLoadModuleUnsigned,"Gain Access","1698430764.0","credential_theft","Credential theft",70,False,"Credential Access","OS Credential Dumping"
15,"An unsigned process obtained a handle to lsass. Adversaries often use this to steal credentials. If credentials were dumped, change your passwords and review the process tree.","Lateral motion",RemoteOpenLsassUnsigned,"Gain Access","1698429517.0","credential_theft","Credential theft",70,False,"Credential Access","OS Credential Dumping"
16,"The security for credential registry keys was modified.","Lateral motion",RegCredentialSecurityModified,"Gain Access","1698429517.0","credential_theft","Credential theft",70,True,"Credential Access","Credentials in Registry"
17,"Command prompt in subtree beneath a browser process",Exploitation,BrowserCmdSubtreeLaunch,"Follow Through","1698429517.0","drive_by_download","Web exploit",10,False,Execution,"Command and Scripting Interpreter"
18,DEPRECATED,Unknown,,,"1698430764.0","suspicious_activity","Suspicious activity",1,False,,
19,"A registry key used for persistence was written from a network-capable process",Unknown,NetworkCapableAsepWrite,"Keep Access","1698429517.0","suspicious_activity","Suspicious activity",10,False,Persistence,"Registry Run Keys / Startup Folder"
20,"A process wrote an executable file and created or modified a service",Unknown,ExeWrittenAndServiceModified,"Keep Access","1698430764.0","suspicious_activity","Suspicious activity",10,False,Persistence,"Windows Service"
21,DEPRECATED,"Lateral motion",,,"1698430764.0","credential_theft","Credential theft",1,False,,
22,DEPRECATED,Exploitation,,,"1698429517.0","drive_by_download","Web exploit",1,False,,
23,"An executable had a suspicious or misleading filename",Exploitation,deprecated,,"1698430764.0","social_engineering","Social engineering",50,False,,
24,"Falcon Overwatch has identified suspicious activity. This has been raised for your awareness and should be investigated as normal.",Unknown,OverWatchAlertSuspicious,"Falcon Detection Method","1698429517.0","overwatch_detection","Falcon Overwatch detection",50,True,"Falcon Overwatch","Suspicious Activity"
25,"Falcon Overwatch has identified malicious activity. This has been raised for immediate action and should be investigated urgently.",Unknown,OverWatchAlertMalicious,"Falcon Detection Method","1698430764.0","overwatch_detection","Falcon Overwatch detection",70,True,"Falcon Overwatch","Malicious Activity"
26,"Falcon Overwatch has identified malicious activity carried out by a suspected or known nation-state adversary. This has been raised for immediate action and should be investigated immediately.",Unknown,OverWatchAlertAdversary,"Falcon Detection Method","1698429517.0","overwatch_detection","Falcon Overwatch detection",90,True,"Falcon Overwatch","Malicious Activity"
27,"A browser created a process via shellcode.",Exploitation,BrowserShellcodeCreateThread,"Follow Through","1698429517.0","drive_by_download","Web exploit",50,True,Execution,"Exploitation for Client Execution"
28,"A browser created a process via shellcode.",Exploitation,BrowserShellcodeStackPivot,"Follow Through","1698430764.0","drive_by_download","Web exploit",50,True,Execution,"Exploitation for Client Execution"
29,"A browser created a process via shellcode.",Exploitation,BrowserShellcodeExecutableStackPivot,"Follow Through","1698430764.0","drive_by_download","Web exploit",50,True,Execution,"Exploitation for Client Execution"
30,"A process loaded a restricted credential module.","Lateral motion",CredentialModuleLoadSuspicious,"Gain Access","1698429517.0","credential_theft","Credential theft",70,True,"Credential Access","OS Credential Dumping"
31,"User hashes from SAM hive accessed","Lateral motion",HashDumpSAM,"Gain Access","1698430764.0","credential_theft","Credential theft",70,False,"Credential Access","OS Credential Dumping"
32,"A productivity app launched a process from an executable stack.",Exploitation,SpearPhishExecutableStack,"Follow Through","1698429517.0","malicious_document","Malicious document",50,True,Execution,"Exploitation for Client Execution"
33,"Productivity app injected a thread into another process",Unknown,ProductivityAppInjectedThread,"Gain Access","1698430764.0","suspicious_activity","Suspicious activity",50,False,"Privilege Escalation","Dynamic-link Library Injection"
34,"Java injected a thread into another process",Unknown,JavaInjectedThread,"Gain Access","1698429517.0","suspicious_activity","Suspicious activity",50,False,"Privilege Escalation","Dynamic-link Library Injection"
35,"A thread was injected into LSASS.","Lateral motion",LsassInjectedThread,"Gain Access","1698429517.0","credential_theft","Credential theft",70,True,"Credential Access","OS Credential Dumping"
36,"A DLL was injected into LSASS.","Lateral motion",LsassDllInjection,"Gain Access","1698430764.0","credential_theft","Credential theft",50,True,"Credential Access","OS Credential Dumping"
37,"An IIS worker process spawned a command prompt. This is anomalous behavior and often indicative of an exploit or webshell.",Unknown,IISLaunchCmd,"Gain Access","1698429517.0","suspicious_activity","Suspicious activity",70,False,"Initial Access","Exploit Public-Facing Application"
38,"A process indirectly stole a privileged security token via DLL injection.",Installation,ActiveIndirectPrivilegeEscalation,"Gain Access","1698430764.0","privilege_escalation","Privilege escalation",70,False,"Privilege Escalation","Process Injection"
39,"The security registry hive was read using raw disk access.","Lateral motion",RawReadOnSecurityHive,"Gain Access","1698430764.0","credential_theft","Credential theft",70,True,"Credential Access","Credentials in Registry"
40,"The Windows Security Account Manager (SAM) registry hive was read using raw disk access.","Lateral motion",RawReadOnSAMHive,"Gain Access","1698429517.0","credential_theft","Credential theft",70,True,"Credential Access","Credentials in Registry"
41,"Firefox wrote a new add-on installer with suspicious characteristics to the file system",Exploitation,FirefoxInstallManifest,"Follow Through","1698430764.0","drive_by_download","Web exploit",10,False,Execution,"Software Deployment Tools"
42,"A Firefox browser opened a command line interface. Adversaries often use this to execute malicious code. Review the process tree.",Exploitation,FirefoxLaunchCmd,"Follow Through","1698429517.0","drive_by_download","Web exploit",30,False,Execution,"Command and Scripting Interpreter"
43,"Metasploit's meterpreter server may have been loaded into a process.",Unknown,MeterpreterServerLoad,"Keep Access","1698430764.0","known_malware","Known malware",50,True,"Defense Evasion","Process Injection"
44,"System call made by a browser via shellcode or ROP",Exploitation,,,"1698429517.0","drive_by_download","Web exploit",50,False,,
45,"An image was loaded by a browser from an unusual location",Exploitation,,,"1698430764.0","drive_by_download","Web exploit",50,False,,
46,"A process chain bypassed Windows logon security.",Installation,WindowsLogonBypass,"Keep Access","1698429517.0","privilege_escalation","Privilege escalation",80,True,Persistence,"Accessibility Features"
47,"A process has created a memory dump of LSASS","Lateral motion",LsassProcdump,"Gain Access","1698429517.0","credential_theft","Credential theft",70,False,"Credential Access","OS Credential Dumping"
48,"An IIS worker process opened an administrative/reconnaissance tool. Adversaries sometimes use this to gain access to a system. Review the process tree.",Unknown,IISAdminReconTool,"Gain Access","1698430764.0","suspicious_activity","Suspicious activity",30,False,"Initial Access","Exploit Public-Facing Application"
49,"An ASLR bypass attempt was blocked.",Exploitation,ASLRBypassAttempt,"Falcon Detection Method","1698430764.0","blocked_exploit","Blocked Exploit",70,True,Exploit,"Exploit Mitigation"
50,DEPRECATED,Unknown,,,"1698429517.0","known_malware","Known malware",1,False,,
51,"LSASS process accessed from a signed executable with untrusted root authority","Lateral motion",LsassAccessFromUntrusted,"Gain Access","1698430764.0","credential_theft","Credential theft",70,False,"Credential Access","OS Credential Dumping"
52,"The LSASS process was accessed from the mimikatz hack tool.","Lateral motion",LsassAccessFromMimikatz,"Gain Access","1698429517.0","credential_theft","Credential theft",70,True,"Credential Access","OS Credential Dumping"
53,"Indicates a thread was injected into LSASS from signed executable with untrusted root authority","Lateral motion",LsassInjectedThreadUntrusted,"Gain Access","1698430764.0","credential_theft","Credential theft",50,False,"Credential Access","OS Credential Dumping"
54,"Signed DLL with untrusted root authority loaded by LSASS process","Lateral motion",LsassLoadModuleUntrusted,"Gain Access","1698429517.0","credential_theft","Credential theft",70,False,"Credential Access","OS Credential Dumping"
55,"Security for credential registry keys tampered with from signed executable with untrusted root authority","Lateral motion",RegCredentialSecurityModifiedUntrusted,"Gain Access","1698430764.0","credential_theft","Credential theft",70,False,"Credential Access","OS Credential Dumping"
56,"User hashes from SAM hive accessed from signed executable with untrusted root authority","Lateral motion",HashDumpSAMUntrusted,"Gain Access","1698430764.0","credential_theft","Credential theft",70,False,"Credential Access","OS Credential Dumping"
57,"The SECURITY registry hive was read using raw disk access from a signed executable with untrusted root authority.","Lateral motion",RawReadOnSecurityHiveUntrusted,"Gain Access","1698429517.0","credential_theft","Credential theft",70,False,"Credential Access","OS Credential Dumping"
58,"The SAM registry hive was read using raw disk access from a signed executable with untrusted root authority.","Lateral motion",RawReadOnSAMHiveUntrusted,"Gain Access","1698429517.0","credential_theft","Credential theft",70,False,"Credential Access","OS Credential Dumping"
59,"A process loaded a restricted credential module from a signed executable with untrusted root authority","Lateral motion",CredentialModuleLoadUntrusted,"Gain Access","1698430764.0","credential_theft","Credential theft",70,False,"Credential Access","OS Credential Dumping"
60,"JavaScript was executed from the command line via rundll32.exe (rundll32.exe was launched from the command line and included the ""javascript:"" argument).",Unknown,JavaScriptViaRundll32,"Keep Access","1698430764.0","suspicious_activity","Suspicious activity",50,True,"Defense Evasion",Rundll32
61,"Admin/recon tool in subtree beneath a browser process",Exploitation,AdminOrReconUnderBrowser,Explore,"1698429517.0","drive_by_download","Web exploit",50,False,Discovery,"System Information Discovery"
62,"Detected file access and deletion activity that is consistent with known wipers such as Wipall.",ActionsOnObjectives,WipallWiper,"Follow Through","1698429517.0","data_deletion","Deletion of data",60,False,Impact,"Data Destruction"
63,DEPRECATED,ResponseActions,,,"1698430764.0","process_terminated","A process was terminated in response to malicious behavior",80,False,,
64,DEPRECATED,ResponseActions,,,"1698429517.0","activity_prevented","A malicious activity was prevented",1,False,,
65,DEPRECATED,Unknown,,,"1698430764.0","suspicious_activity","Suspicious activity",1,False,,
66,"VNC Server's DLL was loaded into a process",Unknown,VncServerLoaded,Explore,"1698429517.0","known_malware","Known malware",50,False,"Lateral Movement","Remote Services"
67,"Process accessed credential-containing NTDS.dit in a Volume Shadow Snapshot","Lateral motion",NtdsFileAccessedViaVss,"Gain Access","1698430764.0","credential_theft","Credential theft",100,True,"Credential Access","OS Credential Dumping"
68,"Process used raw read to access the NTDS.dit file, which contains credentials.","Lateral motion",NtdsFileAccessedViaRaw,"Gain Access","1698429517.0","credential_theft","Credential theft",80,True,"Credential Access","OS Credential Dumping"
69,DEPRECATED,Unknown,,,"1698429517.0","suspicious_activity","Suspicious activity",1,False,,
70,"A command prompt was created in association with browser flash plugin activity",Exploitation,FlashThreadCreateCLI,"Follow Through","1698430764.0","drive_by_download","Web exploit",70,True,Execution,"Exploitation for Client Execution"
71,DEPRECATED,Unknown,,,"1698429517.0","suspicious_activity","Suspicious activity",1,False,,
72,DEPRECATED,Unknown,,,"1698429517.0","suspicious_activity","Suspicious activity",1,False,,
73,DEPRECATED,Unknown,,,"1698430764.0","suspicious_activity","Suspicious activity",1,False,,
74,"An executable had a suspicious or misleading filename","Lateral motion",deprecated,,"1698430764.0","credential_theft","Credential theft",1,False,,
75,DEPRECATED,Unknown,,,"1698430764.0","suspicious_activity","Suspicious activity",10,False,,
76,"Falcon Host's installation directory was probed",Unknown,FalconSensorDirectoryProbe,Explore,"1698429517.0","suspicious_activity","Suspicious activity",10,False,Discovery,"Security Software Discovery"
77,"Falcon Host's network connection may have been probed",Unknown,FalconSensorNetworkProbe,Explore,"1698430764.0","suspicious_activity","Suspicious activity",10,False,Discovery,"Security Software Discovery"
78,"Falcon Host's service was probed",Unknown,FalconSensorServiceProbe,Explore,"1698429517.0","suspicious_activity","Suspicious activity",10,False,Discovery,"Security Software Discovery"
79,"A userspace process spawned a new process and used it to execute shellcode. Adversaries often inject malicious code into a benign process to evade detection. Review both the injector and injectee process trees.",Unknown,ProcessMigrationViaShellcode,"Keep Access","1698429517.0","suspicious_activity","Suspicious activity",70,False,"Defense Evasion","Process Injection"
80,"Detected and blocked a heap spray attempt, which was likely part of an attempted exploit.",Exploitation,HeapSprayAttempted,"Falcon Detection Method","1698430764.0","blocked_exploit","Blocked Exploit",70,True,Exploit,"Exploit Mitigation"
81,"An unexpected process ran dllhost.exe. Adversaries can masquerade malware as a system process to evade detection. Review the executable.",Unknown,UnexpectedDllhostProcess,"Keep Access","1698429517.0","suspicious_activity","Suspicious activity",50,False,"Defense Evasion",Masquerading
82,"An unexpected process ran svchost.exe. Adversaries can masquerade malware as a system process to evade detection. Review the executable.",Unknown,UnexpectedSvchostProcess,"Follow Through","1698429517.0","suspicious_activity","Suspicious activity",50,True,Execution,"Command and Scripting Interpreter"
83,"An unexpected process ran taskhost.exe. Adversaries can masquerade malware as a system process to evade detection. Review the executable.",Unknown,UnexpectedTaskhostProcess,"Keep Access","1698430764.0","suspicious_activity","Suspicious activity",50,False,"Defense Evasion",Masquerading
84,"An unexpected process ran wmiprvse.exe. Adversaries can masquerade malware as a system process to evade detection. Review the executable.",Unknown,UnexpectedWmiprvseProcess,"Keep Access","1698430764.0","suspicious_activity","Suspicious activity",50,False,"Defense Evasion",Masquerading
85,"An unexpected process ran csrss.exe. Adversaries can masquerade malware as a system process to evade detection. Review the executable.",Unknown,UnexpectedCsrssProcess,"Keep Access","1698430764.0","suspicious_activity","Suspicious activity",50,False,"Defense Evasion",Masquerading
86,"An unexpected process ran lsass.exe. Adversaries can masquerade malware as a system process to evade detection. Review the executable.",Unknown,UnexpectedLsassProcess,"Keep Access","1698429517.0","suspicious_activity","Suspicious activity",50,False,"Defense Evasion",Masquerading
87,"An unexpected process ran lsm.exe. Adversaries can masquerade malware as a system process to evade detection. Review the executable.",Unknown,UnexpectedLsmProcess,"Keep Access","1698429517.0","suspicious_activity","Suspicious activity",50,False,"Defense Evasion",Masquerading
88,"An unexpected process ran taskhostex.exe. Adversaries can masquerade malware as a system process to evade detection. Review the executable.",Unknown,UnexpectedTaskhostexProcess,"Keep Access","1698430764.0","suspicious_activity","Suspicious activity",50,False,"Defense Evasion",Masquerading
89,"An unexpected process ran userinit.exe. Adversaries can masquerade malware as a system process to evade detection. Review the executable.",Unknown,UnexpectedUserinitProcess,"Keep Access","1698429517.0","suspicious_activity","Suspicious activity",50,False,"Defense Evasion",Masquerading
90,"An unexpected process ran wininit.exe. Adversaries can masquerade malware as a system process to evade detection. Review the executable.",Unknown,UnexpectedWininitProcess,"Keep Access","1698430764.0","suspicious_activity","Suspicious activity",50,False,"Defense Evasion",Masquerading
91,"An unexpected process ran winlogon.exe. Adversaries can masquerade malware as a system process to evade detection. Review the executable.",Unknown,UnexpectedWinlogonProcess,"Keep Access","1698429517.0","suspicious_activity","Suspicious activity",50,False,"Defense Evasion",Masquerading
92,"An unexpected process ran smss.exe. Adversaries can masquerade malware as a system process to evade detection. Review the executable.",Unknown,UnexpectedSmssProcess,"Keep Access","1698430764.0","suspicious_activity","Suspicious activity",50,False,"Defense Evasion",Masquerading
93,"IIS wrote and ran a new executable.",Exploitation,IISWroteAndExecuted,"Gain Access","1698429517.0","server_compromise","Server exploited",80,True,"Initial Access","Exploit Public-Facing Application"
94,"IIS wrote a new executable and a sub-process ran it.",Exploitation,IISWroteAndChildExecuted,"Gain Access","1698430764.0","server_compromise","Server exploited",80,True,"Initial Access","Exploit Public-Facing Application"
95,"SQL Server wrote and ran a new executable.",Exploitation,SqlWroteAndExecuted,"Gain Access","1698430764.0","server_compromise","Server exploited",80,True,"Initial Access","Exploit Public-Facing Application"
96,"SQL Server wrote a new executable and a sub-process ran it.",Exploitation,SqlWroteAndChildExecuted,"Gain Access","1698429517.0","server_compromise","Server exploited",80,True,"Initial Access","Exploit Public-Facing Application"
97,"An IIS sub-process wrote a new executable and a sub-process ran it.",Exploitation,ISSChildWroteAndExecuted,"Gain Access","1698429517.0","server_compromise","Server exploited",80,True,"Initial Access","Exploit Public-Facing Application"
98,"SQL Server sub-process wrote a new executable and a sub-process ran it.",Exploitation,SqlChildWroteAndExecuted,"Gain Access","1698430764.0","server_compromise","Server exploited",80,True,"Initial Access","Exploit Public-Facing Application"
99,"A process using Force Data Execution Prevention (Force DEP) tried to execute non-executable memory. The process was blocked.",Exploitation,ForceDEPExecution,"Falcon Detection Method","1698430764.0","blocked_exploit","Blocked Exploit",70,True,Exploit,"Exploit Mitigation"
100,DEPRECATED,Unknown,,,"1698429517.0","suspicious_activity","Suspicious activity",1,False,,
101,"Prevented the creation of a command line process associated with Windows logon bypass.",ResponseActions,WindowsLogonBypassPrevented,"Keep Access","1698429517.0","activity_prevented","A malicious activity was prevented",80,True,Persistence,"Accessibility Features"
102,"A browser executed a .tmp file.",Unknown,BrowserExecutedTmpFile,"Follow Through","1698430764.0","suspicious_activity","Suspicious activity",70,True,Execution,"Exploitation for Client Execution"
103,"A productivity application or its child modified a registry key for persistence, which does not match its expected behavior.",Unknown,ProductivityAppWroteAsep,"Keep Access","1698429517.0","suspicious_activity","Suspicious activity",60,False,Persistence,"Registry Run Keys / Startup Folder"
104,"Falcon Host's registry data was modified via uninstallation.",Unknown,FalconSensorRegistryKeyUninstall,"Keep Access","1698430764.0","suspicious_activity","Suspicious activity",10,False,"Defense Evasion","Disable or Modify Tools"
105,"A process tampered with Falcon Host's registry data.",Unknown,,,"1698430764.0","suspicious_activity","Suspicious activity",50,False,,
106,"Falcon Host's directory content was modified via uninstallation.",Unknown,FalconSensorHostDirectoryUninstall,"Keep Access","1698429517.0","suspicious_activity","Suspicious activity",10,False,"Defense Evasion","Disable or Modify Tools"
107,"A process tampered with Falcon Host's directory content.",Unknown,FalconSensorHostDirectoryTampering,"Keep Access","1698429517.0","suspicious_activity","Suspicious activity",50,False,"Defense Evasion","Disable or Modify Tools"
108,"A process tried to disable system recovery.",Unknown,ProcessDisabledSystemRecovery,"Keep Access","1698430764.0","suspicious_activity","Suspicious activity",70,False,"Defense Evasion","Disable or Modify Tools"
109,"A process chain bypassed Windows logon security.",Installation,WindowsLogonBypassSuspicious,"Keep Access","1698430764.0","privilege_escalation","Privilege escalation",80,True,Persistence,"Accessibility Features"
110,"Blocked a command line process associated with Windows logon bypass.",ResponseActions,WindowsLogonBypassSuspiciousPrevent,"Keep Access","1698429517.0","activity_prevented","A malicious activity was prevented",80,True,Persistence,"Accessibility Features"
111,"Unsigned child of a productivity app wrote a registry key used for persistence",Unknown,ProductivityAppChildWroteAsep,"Keep Access","1698429517.0","suspicious_activity","Suspicious activity",50,False,Persistence,"Registry Run Keys / Startup Folder"
112,"A child process of a browser renderer wrote a registry key used for persistence",Unknown,BrowserChildWroteAsep,"Keep Access","1698430764.0","suspicious_activity","Suspicious activity",50,False,Persistence,"Registry Run Keys / Startup Folder"
113,"A remote process obtained a handle to lsass. Adversaries often use this to steal credentials. If credentials were dumped, change your passwords and review the process tree.","Lateral motion",RemoteOpenLsass,"Gain Access","1698430764.0","credential_theft","Credential theft",50,False,"Credential Access","OS Credential Dumping"
