"PatternId_decimal",description,"killchain_stage",name,objective,"pattern_updated",scenario,scenarioFriendly,severity,"show_in_ui",tactic,technique
7731,"MICRO BEHAVIOR: A process violated the CET user-mode shadow stack policyin prevention mode.",Unknown,,,"1698430764.0","micro_behavior","Process micro behavior",10,False,,
7732,"MICRO BEHAVIOR: A process modified /etc/passwd",Unknown,"Etc Passwd Modified","Keep Access","1698430764.0","micro_behavior","Process micro behavior",10,False,"Defense Evasion","Impair Defenses"
7733,"A process modified a system dll.",Unknown,,,"1698430764.0","micro_behavior","Process micro behavior",10,False,,
7734,"MICRO BEHAVIOR: A process wrote a native executable marked as DLL in it's PE header to disk.",Unknown,,,"1698429517.0","micro_behavior","Process micro behavior",10,False,,
7735,"MICRO BEHAVIOR: A process wrote a native executable marked as driver model WDM in it's PE header to disk.",Unknown,,,"1698429517.0","micro_behavior","Process micro behavior",10,False,,
7736,"One of kubernetes certs was accessed by unusual process.",Unknown,,,"1698429517.0","micro_behavior","Process micro behavior",40,False,,
7737,"A process modified a CrowdStrike dependency.",Unknown,,,"1698429517.0","micro_behavior","Process micro behavior",10,False,,
7738,"A process truncated a .bash_history file to a small size",Unknown,,,"1698429517.0","micro_behavior","Process micro behavior",10,False,,
7739,"MICRO BEHAVIOR: A process modified a critical file in the PAM configuration.",Unknown,,"Keep Access","1698430764.0","micro_behavior","Process micro behavior",10,False,"Defense Evasion","Modify Authentication Process"
7741,"MICRO BEHAVIOR: A process was found enumerating process cabalities inside a container",Unknown,,,"1698430764.0","micro_behavior","Process micro behavior",60,False,,
7742,"A process may be attempting to read Securityd and dump passwords.",Unknown,SecuritydPassDump,"Gain Access","1698430764.0","micro_behavior","Process micro behavior",10,False,"Credential Access","Credentials from Password Stores"
7743,"An outbound network connection was made on remote port 88.",Unknown,,,"1698430764.0","micro_behavior","Process micro behavior",10,False,,
7744,"A file was executed that was packed with ASPACK.",Unknown,,,"1698430764.0","micro_behavior","Process micro behavior",10,False,,
7745,"A file was executed that was packed with MPRESS.",Unknown,,,"1698429517.0","micro_behavior","Process micro behavior",10,False,,
7746,"A file was executed that was packed with THEMIDA.",Unknown,,,"1698429517.0","micro_behavior","Process micro behavior",10,False,,
7747,"A file was executed that was packed with UPX.",Unknown,,,"1698429517.0","micro_behavior","Process micro behavior",10,False,,
7748,"A file was executed that was packed with VMProtect.",Unknown,,,"1698429517.0","micro_behavior","Process micro behavior",10,False,,
7749,"A process has written a registry hive file.",Unknown,"Windows Registry Hive File Written",Explore,"1698429517.0","micro_behavior","Process micro behavior",10,False,Discovery,"System Information Discovery"
7750,"A process has written a SAM registry hive file.",Unknown,"SAM Registry Hive File Written",Explore,"1698430764.0","micro_behavior","Process micro behavior",10,False,Discovery,"System Information Discovery"
7751,"A process has written a SECURITY registry hive file.",Unknown,"SECURITY Registry Hive File Written",Explore,"1698430764.0","micro_behavior","Process micro behavior",10,False,Discovery,"System Information Discovery"
7752,"A process has written a SOFTWARE registry hive file.",Unknown,"SOFTWARE Registry Hive File Written",Explore,"1698430764.0","micro_behavior","Process micro behavior",10,False,Discovery,"System Information Discovery"
7753,"A process has written a SYSTEM registry hive file.",Unknown,"SYSTEM Registry Hive File Written",Explore,"1698430764.0","micro_behavior","Process micro behavior",10,False,Discovery,"System Information Discovery"
7754,"A process has written a DEFAULT registry hive file.",Unknown,"DEFAULT Registry Hive File Written",Explore,"1698430764.0","micro_behavior","Process micro behavior",10,False,Discovery,"System Information Discovery"
7755,"A process has written a NTUSER registry hive file.",Unknown,"NTUSER Registry Hive File Written",Explore,"1698429517.0","micro_behavior","Process micro behavior",10,False,Discovery,"System Information Discovery"
7756,"A process connected to a port associated with the Sliver C2 Agent",Unknown,"Connection to Default Sliver Port",Explore,"1698430764.0","micro_behavior","Process micro behavior",10,False,"Lateral Movement","Remote Services"
7757,"There is a strong indication that a malicious Process Injection has executed on your machine. Review the injection event and any related activity.",Unknown,"AI Identified High Confidence Process Injection","Falcon Detection Method","1698429517.0","attacker_methodology","Attacker Methodology",70,False,"AI Powered IOA","Process Injection"
7758,"There is a strong indication that a malicious Process Injection has executed on your machine. Review the injection event and any related activity.",Unknown,"AI Identified Medium Confidence Process Injection","Falcon Detection Method","1698429517.0","attacker_methodology","Attacker Methodology",70,False,"AI Powered IOA","Process Injection"
7759,"There is an indication that a potential malicious Process Injection has executed on your machine. Review the injection event and any related activity.",Unknown,"AI Identified Low Confidence Process Injection","Falcon Detection Method","1698429517.0","attacker_methodology","Attacker Methodology",70,False,"AI Powered IOA","Process Injection"
7760,"There is an indication that a potential malicious Process Injection has executed on your machine. Review the injection event and any related activity.",Unknown,"AI Identified Very Low Confidence Process Injection","Falcon Detection Method","1698429517.0","attacker_methodology","Attacker Methodology",70,False,"AI Powered IOA","Process Injection"
7761,"There is an indication that a suspicious Process Injection has executed on your machine. Review the injection event and any related activity.",Unknown,"AI Identified High Threshold Process Injection","Falcon Detection Method","1698430764.0","attacker_methodology","Attacker Methodology",70,False,"AI Powered IOA","Process Injection"
7762,"There is an indication that a suspicious Process Injection has executed on your machine. Review the injection event and any related activity.",Unknown,"AI Identified Medium Threshold Process Injection","Falcon Detection Method","1698430764.0","attacker_methodology","Attacker Methodology",70,False,"AI Powered IOA","Process Injection"
7763,"This process patched ntdll in a remote process.",Unknown,,,"1698430764.0","micro_behavior","Process micro behavior",10,False,,
7764,"This process patched kernel32 in a remote process.",Unknown,,,"1698430764.0","micro_behavior","Process micro behavior",10,False,,
7765,"This process patched kernelbase in a remote process.",Unknown,,,"1698430764.0","micro_behavior","Process micro behavior",10,False,,
7766,"The primary module of the process was written to disk by a sibling process",Unknown,"Process Executable Created By Sibling Process","Keep Access","1698429517.0","micro_behavior","Process micro behavior",10,False,"Defense Evasion","Hide Artifacts"
7767,"LD_PRELOAD env variable was set with an unusual value in container. This could lead to dynamic loading hijacking.",Unknown,,"Keep Access","1698429517.0","micro_behavior","Process micro behavior",70,False,Persistence,"Dynamic Linker Hijacking"
7768,"A process has written an ADExplorer snapshot file format to disk.",Unknown,,,"1698429517.0","micro_behavior","Process micro behavior",10,False,,
7769,"A process created an NTFS Symbolic Link",Unknown,,,"1698429517.0","micro_behavior","Process micro behavior",10,False,,
7770,"A process created an NTFS Mount Point",Unknown,,,"1698429517.0","micro_behavior","Process micro behavior",10,False,,
7771,"The shell's clear history command was run.",Unknown,,,"1698430764.0","micro_behavior","Process micro behavior",10,False,,
7772,"This process loaded the windows library wwmanmm.dll.",Unknown,"wwmanmm.dll Loaded","Contact Controlled Systems","1698430764.0","micro_behavior","Process micro behavior",10,False,"Command and Control","Non-Application Layer Protocol"
7774,"A process created or modified a Value under a machine Run Key",Unknown,,,"1698430764.0","micro_behavior","Process micro behavior",10,False,,
7775,"MICRO BEHAVIOR: This process loaded the windows library \windows\system32\CI.dll.",Unknown,,,"1698430764.0","micro_behavior","Process micro behavior",10,False,,
7776,"MICRO BEHAVIOR: This process loaded the windows OS binary \windows\system32\ntoskrnl.exe.",Unknown,,,"1698430764.0","micro_behavior","Process micro behavior",10,False,,
7777,"A process accessed data associated with a password manager",Unknown,"Password Manager Data Accessed","Gain Access","1698429517.0","micro_behavior","Process micro behavior",10,False,"Credential Access","Unsecured Credentials"
7778,"A process's initial exeuction is similar to a Sliver binary",Unknown,"Possible Sliver Agent Execution","Follow Through","1698429517.0","micro_behavior","Process micro behavior",10,False,Execution,"Native API"
7779,"The process created a SSH shell.",Unknown,"Process received a SSH connection and created a SSH shell.",Explore,"1698429517.0","micro_behavior","Process micro behavior",10,False,"Lateral Movement","Remote Services"
7780,"Process received a SSH connection from an internal IP address.",Unknown,"An internal IP address opened a SSH shell on the machine.",Explore,"1698429517.0","micro_behavior","Process micro behavior",10,False,"Lateral Movement","Remote Services"
7781,"The process invoked CreateProcess using the EXTENDED_STARTUPINFO_PRESENT flag.",Unknown,,,"1698429517.0","micro_behavior","Process micro behavior",10,False,,
7782,"The process has been created with the EXTENDED_STARTUPINFO_PRESENT flag.",Unknown,,,"1698430764.0","micro_behavior","Process micro behavior",10,False,,
7784,"A process created an NTFS Mount Point in the default OneDrive folder",Unknown,,,"1698430764.0","micro_behavior","Process micro behavior",10,False,,
7785,"A process has written an Extensible Storage Engine (ESE) file to disk.",Unknown,,,"1698430764.0","micro_behavior","Process micro behavior",10,False,,
7786,"A process enabled the SSH service on the system with the system setup command.",Unknown,"A Process Enabled the SSH Service",Explore,"1698430764.0","micro_behavior","Process micro behavior",10,False,"Lateral Movement","Remote Services"
7787,"A process received a SSH login that was denied",Unknown,"A Process Received a SSH Login That Was Denied",Explore,"1698430764.0","micro_behavior","Process micro behavior",10,False,"Lateral Movement","Remote Services"
7788,"A process received a SSH login that was accepted",Unknown,"A Process Received a SSH Login That Was Accepted",Explore,"1698429517.0","micro_behavior","Process micro behavior",10,False,"Lateral Movement","Remote Services"
7790,"Parent of a process created with debug flag.",Unknown,,,"1698429517.0","micro_behavior","Process micro behavior",10,False,,
7791,"Process created with debug flag.",Unknown,,,"1698430764.0","micro_behavior","Process micro behavior",10,False,,
7792,"A process different than Chrome.exe accessed cookie data of Chrome.",Unknown,,,"1698429517.0","micro_behavior","Process micro behavior",10,False,,
7793,"A process cleared a system log to evade defences",Unknown,"A Process Cleared A System Log To Evade Defences",Explore,"1698429517.0","micro_behavior","Process micro behavior",10,False,"Lateral Movement","Remote Services"
7794,"A webserver connected to IMDS in an unexpected fashion. Usually webservers connect to IMDS when they start and then again at a later time for refreshing tokens. This webserver connected to IMDS only at a later time. Review webserver's process tree.",Unknown,,,"1698430764.0","micro_behavior","Process micro behavior",30,False,,
7795,"A webserver connected to IMDS repeatedly late after starting. Usually webservers connect to IMDS sporadically to get and refresh tokens from IMDS throughout their life. Review webserver's process tree.",Unknown,,,"1698430764.0","micro_behavior","Process micro behavior",40,False,,
7796,"A process has loaded a module that is loaded for the first time on the host.",Unknown,,,"1698429517.0","micro_behavior","Process micro behavior",10,False,,
7797,"A process accessed a file associated with the Javascript component that compiles/executes JXA scripts",Unknown,"A Process Executed or Compiled a JXA Script","Follow Through","1698430764.0","micro_behavior","Process micro behavior",10,False,Execution,"Command and Scripting Interpreter"
7798,"A process other than tccd has modified the TCC database file",Unknown,"TCC Database Modified","Keep Access","1698430764.0","micro_behavior","Process micro behavior",10,False,"Defense Evasion","Impair Defenses"
7799,"A process accessed a file associated with the execution and compiling of Apple Script files",Unknown,"A Process Executed or Compiled an Apple Script File","Follow Through","1698429517.0","micro_behavior","Process micro behavior",10,False,Execution,"Command and Scripting Interpreter"
7800,"A process is listening for connections on a high-numbered port, within the default range for an ephemeral port.",Unknown,,,"1698429517.0","micro_behavior","Process micro behavior",10,False,,
7801,"An identified vulnerable driver was written to disk",Unknown,,,"1698430764.0","micro_behavior","Process micro behavior",70,False,,
7802,"An identified vulnerable driver was loaded",Unknown,,,"1698430764.0","micro_behavior","Process micro behavior",70,False,,
7803,"An identified vulnerable driver was blocked from loading",Unknown,,,"1698430764.0","micro_behavior","Process micro behavior",70,False,,
7804,"A driver file of interest was written to disk",Unknown,,,"1698429517.0","micro_behavior","Process micro behavior",30,False,,
7805,"A dll file of interest was written to disk",Unknown,,,"1698429517.0","micro_behavior","Process micro behavior",30,False,,
7806,"A exe file of interest was written to disk",Unknown,,,"1698429517.0","micro_behavior","Process micro behavior",30,False,,
7807,"A process attempted to open a handle with PROCESS_SUSPEND_RESUME access right to a CrowdStrike critical process.",Unknown,,,"1698429517.0","micro_behavior","Process micro behavior",10,False,,
7808,"A process attempted to send a SIGSTOP signal to another process",Unknown,"Process Attempted SIGSTOP","Keep Access","1698430764.0","micro_behavior","Process micro behavior",10,False,"Defense Evasion","Impair Defenses"
7809,"A process accessed a directory/file associated with a cryptocurrency wallet",Unknown,"Process Accessed Crypto Wallet","Gain Access","1698430764.0","micro_behavior","Process micro behavior",10,False,"Credential Access","Unsecured Credentials"
7810,"A process created an NTFS Hard Link",Unknown,,,"1698430764.0","micro_behavior","Process micro behavior",10,False,,
7812,"MICRO BEHAVIOR: Kubelet received an anomolous network connection from a public IP address. Such activity may be indicative of information-gathering or attempted hijacking of a kubernetes node.",Unknown,,,"1698430764.0","micro_behavior","Process micro behavior",50,False,,
7819,"A process accessed the CFUserTextEncoding file, associated with various C2 agent startup machines",Unknown,"CFUserTextEncoding Accessed","Follow Through","1698430764.0","micro_behavior","Process micro behavior",10,False,Execution,"Native API"
7834,"A process started that exhibits the behavior of the Sliver implant executed by a user",Unknown,"Sliver User Execution","Follow Through","1698429517.0","micro_behavior","Process micro behavior",10,False,Execution,"Native API"
7836,"A process created a Google Chrome extension (CRX) file type.",Unknown,,,"1698429517.0","micro_behavior","Process micro behavior",10,False,,
7838,"Process wrote a file to the users temporary directory",Unknown,"User Temporary Directory File Write","Keep Access","1698429517.0","micro_behavior","Process micro behavior",10,False,"Defense Evasion","Hide Artifacts"
7839,"Process executed a file from the users temporary directory",Unknown,"User Temporary Directory File Execution","Follow Through","1698429517.0","micro_behavior","Process micro behavior",10,False,Execution,"Native API"
7840,"A process wrote an artifact indicative of reflective code loading",Unknown,"Reflective code loading",,"1698430764.0","micro_behavior","Process micro behavior",10,False,,
7841,"A generic rollup for collection-mapped microbehaviors.",Unknown,,,"1698429517.0","micro_behavior","Process micro behavior",10,False,,
7842,"A process accessed the NoteStore files",Unknown,"NoteStore file access",,"1698430764.0","micro_behavior","Process micro behavior",10,False,,
7845,"A process started while Install Guard was disabled",Unknown,,,"1698430764.0","micro_behavior","Process micro behavior",10,False,,
7846,"A process called AdjustTokenPrivileges to enable SeDebugPrivilege.",Unknown,,,"1698430764.0","micro_behavior","Process micro behavior",10,False,,
7847,"A process called AdjustTokenPrivileges to enable SeBackupPrivilege.",Unknown,,,"1698430764.0","micro_behavior","Process micro behavior",10,False,,
7848,"A process called AdjustTokenPrivileges to enable SeShutdownPrivilege.",Unknown,,,"1698429517.0","micro_behavior","Process micro behavior",10,False,,
7849,"A process called AdjustTokenPrivileges to enable SeLoadDriverPrivilege.",Unknown,,,"1698429517.0","micro_behavior","Process micro behavior",10,False,,
7900,"SHADOW PATTERN: Meekus High",Unknown,,,"1698429517.0","shadow_pattern","Shadow pattern",70,False,,
7901,"SHADOW PATTERN: Meekus Medium",Unknown,,,"1698429517.0","shadow_pattern","Shadow pattern",50,False,,
7902,"SHADOW PATTERN: Meekus Low",Unknown,,,"1698429517.0","shadow_pattern","Shadow pattern",30,False,,
7903,"SHADOW PATTERN: Meekus Lowest",Unknown,,,"1698430764.0","shadow_pattern","Shadow pattern",10,False,,
7904,"SHADOW PATTERN: Prewitt High",Unknown,,,"1698430764.0","shadow_pattern","Shadow pattern",70,False,,
7905,"SHADOW PATTERN: Prewitt Medium",Unknown,,,"1698430764.0","shadow_pattern","Shadow pattern",50,False,,
7906,"SHADOW PATTERN: Prewitt Low",Unknown,,,"1698430764.0","shadow_pattern","Shadow pattern",30,False,,
7907,"SHADOW PATTERN: Prewitt Lowest",Unknown,,,"1698429517.0","shadow_pattern","Shadow pattern",10,False,,
7908,"SHADOW PATTERN: Maurice High",Unknown,,,"1698429517.0","shadow_pattern","Shadow pattern",70,False,,
7909,"SHADOW PATTERN: Maurice Medium",Unknown,,,"1698430764.0","shadow_pattern","Shadow pattern",50,False,,
7910,"SHADOW PATTERN: Maurice Low",Unknown,,,"1698429517.0","shadow_pattern","Shadow pattern",30,False,,
7911,"SHADOW PATTERN: Maurice Lowest",Unknown,,,"1698430764.0","shadow_pattern","Shadow pattern",10,False,,
7912,"SHADOW PATTERN: Todd High",Unknown,,,"1698429517.0","shadow_pattern","Shadow pattern",70,False,,
7913,"SHADOW PATTERN: Todd Medium",Unknown,,,"1698429517.0","shadow_pattern","Shadow pattern",50,False,,
7914,"SHADOW PATTERN: Todd Low",Unknown,,,"1698430764.0","shadow_pattern","Shadow pattern",30,False,,
7915,"SHADOW PATTERN: Todd Lowest",Unknown,,,"1698430764.0","shadow_pattern","Shadow pattern",10,False,,
7916,"SHADOW PATTERN: Prewitt PupAdware High",Unknown,,,"1698429517.0","shadow_pattern","Shadow pattern",70,False,,
7917,"SHADOW PATTERN: Prewitt PupAdware Medium",Unknown,,,"1698430764.0","shadow_pattern","Shadow pattern",50,False,,
7918,"SHADOW PATTERN: Prewitt PupAdware Low",Unknown,,,"1698430764.0","shadow_pattern","Shadow pattern",30,False,,
7919,"SHADOW PATTERN: Prewitt PupAdware Lowest",Unknown,,,"1698429517.0","shadow_pattern","Shadow pattern",10,False,,
7920,"SHADOW PATTERN: Maurice PupAdware High",Unknown,,,"1698430764.0","shadow_pattern","Shadow pattern",70,False,,
7921,"SHADOW PATTERN: Maurice PupAdware Medium",Unknown,,,"1698429517.0","shadow_pattern","Shadow pattern",50,False,,
7922,"SHADOW PATTERN: Maurice PupAdware Low",Unknown,,,"1698430764.0","shadow_pattern","Shadow pattern",30,False,,
7923,"SHADOW PATTERN: Maurice PupAdware Lowest",Unknown,,,"1698430764.0","shadow_pattern","Shadow pattern",10,False,,
7924,"SHADOW PATTERN: Todd PupAdware High",Unknown,,,"1698429517.0","shadow_pattern","Shadow pattern",70,False,,
7925,"SHADOW PATTERN: Todd PupAdware Medium",Unknown,,,"1698429517.0","shadow_pattern","Shadow pattern",50,False,,
7926,"SHADOW PATTERN: Todd PupAdware Low",Unknown,,,"1698430764.0","shadow_pattern","Shadow pattern",30,False,,
7927,"SHADOW PATTERN: Todd PupAdware Lowest",Unknown,,,"1698429517.0","shadow_pattern","Shadow pattern",10,False,,
7928,"SHADOW PATTERN: FileBehavioralML High",Unknown,,,"1698429517.0","shadow_pattern","Shadow pattern",70,False,,
7929,"SHADOW PATTERN: FileBehavioralML Medium",Unknown,,,"1698430764.0","shadow_pattern","Shadow pattern",50,False,,
7930,"SHADOW PATTERN: FileBehavioralML Low",Unknown,,,"1698429517.0","shadow_pattern","Shadow pattern",30,False,,
7931,"SHADOW PATTERN: FileBehavioralML Lowest",Unknown,,,"1698430764.0","shadow_pattern","Shadow pattern",10,False,,
7932,"SHADOW PATTERN: FileHybridML High",Unknown,,,"1698430764.0","shadow_pattern","Shadow pattern",70,False,,
7933,"SHADOW PATTERN: FileHybridML Medium",Unknown,,,"1698430764.0","shadow_pattern","Shadow pattern",50,False,,
7934,"SHADOW PATTERN: FileHybridML Low",Unknown,,,"1698429517.0","shadow_pattern","Shadow pattern",30,False,,
7935,"SHADOW PATTERN: FileHybridML Lowest",Unknown,,,"1698430764.0","shadow_pattern","Shadow pattern",10,False,,
7937,"SHADOW PATTERN: Olga High",Unknown,,,"1698429517.0","shadow_pattern","Shadow pattern",70,False,,
7938,"SHADOW PATTERN: Olga Medium",Unknown,,,"1698429517.0","shadow_pattern","Shadow pattern",50,False,,
7939,"SHADOW PATTERN: Olga Low",Unknown,,,"1698429517.0","shadow_pattern","Shadow pattern",30,False,,
7940,"SHADOW PATTERN: Olga Lowest",Unknown,,,"1698430764.0","shadow_pattern","Shadow pattern",10,False,,
7941,"SHADOW PATTERN: Olga PupAdware High",Unknown,,,"1698429517.0","shadow_pattern","Shadow pattern",70,False,,
7942,"SHADOW PATTERN: Olga PupAdware Medium",Unknown,,,"1698430764.0","shadow_pattern","Shadow pattern",50,False,,
7943,"SHADOW PATTERN: Olga PupAdware Low",Unknown,,,"1698430764.0","shadow_pattern","Shadow pattern",30,False,,
7944,"SHADOW PATTERN: Olga PupAdware Lowest",Unknown,,,"1698429517.0","shadow_pattern","Shadow pattern",10,False,,
7945,"SHADOW PATTERN: OnePercentFPConfidenceMalware",Unknown,,,"1698430764.0","shadow_pattern","Shadow pattern",10,False,,
7946,"SHADOW PATTERN: TenPercentFPConfidenceMalware",Unknown,,,"1698429517.0","shadow_pattern","Shadow pattern",10,False,,
7947,"SHADOW PATTERN: SensorLapsang High",Unknown,,,"1698429517.0","shadow_pattern","Shadow pattern",70,False,,
7948,"SHADOW PATTERN: SensorLapsang Medium",Unknown,,,"1698429517.0","shadow_pattern","Shadow pattern",50,False,,
7949,"SHADOW PATTERN: SensorLapsang Low",Unknown,,,"1698430764.0","shadow_pattern","Shadow pattern",30,False,,
7950,"SHADOW PATTERN: SensorLapsang Lowest",Unknown,,,"1698429517.0","shadow_pattern","Shadow pattern",10,False,,
7951,"SHADOW PATTERN: Lapsang High",Unknown,,,"1698430764.0","shadow_pattern","Shadow pattern",70,False,,
7952,"SHADOW PATTERN: Lapsang Medium",Unknown,,,"1698430764.0","shadow_pattern","Shadow pattern",50,False,,
7953,"SHADOW PATTERN: Lapsang Low",Unknown,,,"1698430764.0","shadow_pattern","Shadow pattern",30,False,,
7954,"SHADOW PATTERN: Lapsang Lowest",Unknown,,,"1698429517.0","shadow_pattern","Shadow pattern",10,False,,
8003,"This file meets the Behavioral Analysis ML algorithm's high-confidence threshold for malware. It might be malicious and/or part of an adversary's toolkit. Review the file.",Unknown,,"Falcon Detection Method","1698429517.0","machine_learning","Machine learning",70,True,"Machine Learning","Cloud-based ML"
8004,"This file meets the Behavioral Analysis ML algorithm's medium-confidence threshold for malware. It might be malicious and/or part of an adversary's toolkit. Review the file.",Unknown,,"Falcon Detection Method","1698430764.0","machine_learning","Machine learning",50,True,"Machine Learning","Cloud-based ML"
8005,"This file meets the Behavioral Analysis ML algorithm's low-confidence threshold for malware. It might be malicious and/or part of an adversary's toolkit. Review the file.",Unknown,,"Falcon Detection Method","1698429517.0","machine_learning","Machine learning",30,True,"Machine Learning","Cloud-based ML"
8006,"This file meets the Behavioral Analysis ML algorithm's lowest-confidence threshold for malware. It might be malicious and/or part of an adversary's toolkit. Review the file.",Unknown,,"Falcon Detection Method","1698430764.0","machine_learning","Machine learning",10,True,"Machine Learning","Cloud-based ML"
8007,"This file meets the Behavioral Analysis plus Static Analysis ML algorithm's high-confidence threshold for malware. It might be malicious and/or part of an adversary's toolkit. Review the file.",Unknown,,"Falcon Detection Method","1698430764.0","machine_learning","Machine learning",70,True,"Machine Learning","Cloud-based ML"
8008,"This file meets the Behavioral Analysis plus Static Analysis ML algorithm's medium-confidence threshold for malware. It might be malicious and/or part of an adversary's toolkit. Review the file.",Unknown,,"Falcon Detection Method","1698430764.0","machine_learning","Machine learning",50,True,"Machine Learning","Cloud-based ML"
8009,"This file meets the Behavioral Analysis plus Static Analysis ML algorithm's low-confidence threshold for malware. It might be malicious and/or part of an adversary's toolkit. Review the file.",Unknown,,"Falcon Detection Method","1698429517.0","machine_learning","Machine learning",30,True,"Machine Learning","Cloud-based ML"
