"PatternId_decimal",description,"killchain_stage",name,objective,"pattern_updated",scenario,scenarioFriendly,severity,"show_in_ui",tactic,technique
10435,"An office document suspected of remotely embedding a malicious template was opened. Office documents can embed remote document templates to conceal malicious code. This will be fetched and executed when the document is opened. Review the process tree.",Unknown,EmbeddedCodeInOfficeDoc,"Keep Access","1698430764.0","attacker_methodology","Attacker Methodology",70,True,"Defense Evasion","Template Injection"
10436,"Malicious artifacts were identified in memory. The process may be hijacked or malicious. Adversaries execute malicious code in memory to evade detection. Investigate the process and surrounding events.",Unknown,"Memory Scanning","Falcon Detection Method","1698429517.0","suspicious_activity","Suspicious activity",70,True,"Post-Exploit","Malicious Tool Execution"
10437,"A process launched that contains behavioral characteristics classified as malicious by AI. Review the process, associated process tree, and surrounding events.",Unknown,"Cloud Multi-process Behavior","Falcon Detection Method","1698430764.0","attacker_methodology","Attacker Methodology",60,True,"AI Powered IOA","User Execution"
10438,"A process execution displays command line arguments deemed malicious by AI based on behavioral characteristics. Review the process tree and surrounding events.",Unknown,"Anomalous Process Execution","Falcon Detection Method","1698430764.0","attacker_methodology","Attacker Methodology",60,True,"AI Powered IOA","User Execution"
10439,"A .NET assembly classified as malicious by AI was loaded into the process. Adversaries may load malicious .NET assemblies into a process in order to conceal the execution of malicious payloads. Investigate the process, .NET assemblies, and surrounding events.",Unknown,"Fileless .NET","Falcon Detection Method","1698429517.0","attacker_methodology","Attacker Methodology",70,True,"AI Powered IOA","Reflective Code Loading"
10440,"A process collected email data from a remote email server. Adversaries can use this technique to steal sensitive information. Review the process tree.",Unknown,RemoteEmailCollection,"Follow Through","1698430764.0","suspicious_activity","Suspicious activity",70,True,Collection,"Email Collection"
10441,"A process appears to be disabling or evading security tools or logging. Attackers may do this to evade detection and enable further operations. Review the process tree.",Unknown,GenericDefenseDisabling,"Keep Access","1698430764.0","suspicious_activity","Suspicious activity",70,True,"Defense Evasion","Impair Defenses"
10442,"This process executed behaviors which were identified as suspicious. If this activity is unexpected review the indicator of compromise and any related events.",Unknown,SuspiciousActivityBML,"Falcon Detection Method","1698429517.0","suspicious_activity","Suspicious activity",30,True,"Machine Learning","Cloud-based ML"
10443,"A process searched the registry for insecurely stored credentials. This activity might be indicative of remote credential dumping. Please review associated logging and telemetry for remote registry and/or system access.",Unknown,CredentialsInWindowsRegistry,"Gain Access","1698429517.0","attacker_methodology","Attacker Methodology",10,True,"Credential Access","Unsecured Credentials"
10444,"A vulnerability in a public-facing application may have been exploited. Review the surrounding activity for signs of a compromise.",Unknown,PublicFacingAppExploitation,"Gain Access","1698430764.0","attacker_methodology","Attacker Methodology",70,True,"Initial Access","Exploit Public-Facing Application"
10445,"Attacker tooling (such as SecretsDump or crackmapexec) was observed attempting to access the registry for stored credentials. This activity is indicative of remote credential dumping. Please review associated telemetry for remote registry and/or system access.",Unknown,CredentialsInWindowsRegistryAccessedViaAttackerTooling,"Gain Access","1698429517.0","attacker_methodology","Attacker Methodology",70,True,"Credential Access","Unsecured Credentials"
10446,"A script launched that contained behavioral characteristics classified as malicious by AI. Review the script, associated process tree and surrounding events.",Unknown,"Cross-platform Multiscript","Falcon Detection Method","1698429517.0","attacker_methodology","Attacker Methodology",70,True,"AI Powered IOA","Command and Scripting Interpreter"
10447,"A process has escalated privileges, this could be as a result of an adversary's attempt to bypass access controls or as part of legitimate system administration. Please check the process tree and surrounding events to determine if this activity was expected.",Unknown,SuspiciousPrivEsc,"Gain Access","1698430764.0","suspicious_activity","Suspicious activity",30,True,"Privilege Escalation","Abuse Elevation Control Mechanism"
10448,"Adversaries may interact with the native OS application programming interface (API) to execute behaviors. These native APIs are leveraged by the OS during system boot (when other system components are not yet initialized) as well as carrying out tasks and requests during routine operations. Review the process tree.",Unknown,GenericApiHook,"Follow Through","1698430764.0","attacker_methodology","Attacker Methodology",70,True,Execution,"Native API"
10449,"Adversaries may obtain and abuse credentials of existing accounts as a means of bypassing access controls placed on various resources on systems within the network. Compromised credentials may even be used for persistent access to remote systems and externally available services (e.g. VPNs or remote desktop). Review the process tree.",Unknown,GenericValidAccounts,"Gain Access","1698429517.0","attacker_methodology","Attacker Methodology",70,True,"Initial Access","Valid Accounts"
10450,"Suspicious cryptographic artifacts were identified in memory. Adversaries use encryption or encoding to conceal malicious code or command and control traffic. Investigate the process and surrounding events.",Unknown,SuspiciousCryptoMemScan,"Keep Access","1698430764.0","suspicious_activity","Suspicious activity",70,True,"Defense Evasion","Obfuscated Files or Information"
10451,"Adversaries may execute their own malicious payloads by hijacking environment variables used to load libraries. Adversaries may place a program in an earlier entry in the list of directories stored in the PATH environment variable, which Windows will then execute when it searches sequentially through that PATH listing in search of the binary that was called from a script or the command line. Review the process tree.",Unknown,PathInterceptionEnvVar,"Gain Access","1698430764.0","attacker_methodology","Attacker Methodology",70,True,"Privilege Escalation","Path Interception by PATH Environment Variable"
10452,"Adversaries may schedule data exfiltration to be performed only at certain times of day or at certain intervals. This could be done to blend traffic patterns with normal activity or availability. Review the process tree.",Unknown,ExfilScheduledTransfer,"Follow Through","1698429517.0","attacker_methodology","Attacker Methodology",70,True,Exfiltration,"Scheduled Transfer"
10453,"Adversaries may execute their own malicious payloads by hijacking vulnerable file path references. Adversaries can take advantage of paths that lack surrounding quotations by placing an executable in a higher level directory within the path, so that Windows will choose the adversary's executable to launch. Review the process tree.",Unknown,HijackExecutionFlow,"Keep Access","1698429517.0","attacker_methodology","Attacker Methodology",70,True,"Defense Evasion","Hijack Execution Flow"
10454,"A driver was loaded from a suspicious location, by a suspicious process, or in a suspicious manner. Check that the driver and loading process is expected.",Unknown,SuspiciousDriverLoaded,"Keep Access","1698429517.0","suspicious_activity","Suspicious activity",50,True,"Defense Evasion","Disable or Modify Tools"
10455,"Adversaries may execute their own malicious payloads by hijacking the search order used to load other programs. Because some programs do not call other programs using the full path, adversaries may place their own file in the directory where the calling program is located, causing the operating system to launch their malicious software at the request of the calling program. Review the process tree.",Unknown,PathInterceptionHijack,"Keep Access","1698429517.0","attacker_methodology","Attacker Methodology",70,True,Persistence,"Path Interception by Search Order Hijacking"
10456,"A driver was loaded that was signed with a malicious, revoked, or untrusted certificate. Adversaries may create, acquire, or steal code signing materials to sign their malware or tools, subvert trust controls, and bypass security policies. Check the driver, loading process, and surrounding events.",Unknown,MaliciousRevokedCertificateDrive,"Keep Access","1698429517.0","suspicious_activity","Suspicious activity",70,True,"Defense Evasion","Code Signing"
10457,"Adversaries may modify file or directory permissions/attributes to evade access control lists (ACLs) and access protected files.",Unknown,FileAndDirectoryModifications,"Keep Access","1698430764.0","attacker_methodology","Attacker Methodology",70,True,"Defense Evasion","File and Directory Permissions Modification"
10458,"A suspicious Process Injection that might be related to malicious activity. If this activity is unexpected, review the injection event and any related activity.",Unknown,"Real-Time Process Injection","Falcon Detection Method","1698430764.0","attacker_methodology","Attacker Methodology",70,True,"AI Powered IOA","Process Injection"
10459,"Adversaries may gain access to a system through a user visiting a website over the normal course of browsing. With this technique, the user's web browser is typically targeted for exploitation, but adversaries may also use compromised websites for non-exploitation behavior such as acquiring Application Access Token.",Unknown,DriveByCompromise,"Gain Access","1698430764.0","attacker_methodology","Attacker Methodology",70,True,"Initial Access","Drive-by Compromise"
10460,"Suspicious network activity was detected. Adversaries may steal data by exfiltrating it over an existing command and control channel. Review the process tree, associated file system, and network activity.",Unknown,ExfiltrationOverC2Channel,"Follow Through","1698430764.0","attacker_methodology","Attacker Methodology",70,True,Exfiltration,"Exfiltration Over C2 Channel"
10461,"Suspicious network activity was detected. Adversaries may steal data by exfiltrating it over a different protocol than that of the existing command and control channel. The data may also be sent to an alternate network location from the main command and control server. Review the process tree, associated file system, network activity.",Unknown,ExfiltrationOverAlternateProtocol,"Follow Through","1698430764.0","attacker_methodology","Attacker Methodology",70,True,Exfiltration,"Exfiltration Over Alternative Protocol"
10462,"A suspicious attempt was made to access the Windows Credential Manager. Adversaries may acquire credentials from the Windows Credential Manager. The Credential Manager stores credentials for signing into websites, applications, and/or devices that request authentication through NTLM or Kerberos in Credential Lockers (previously known as Windows Vaults). Review the process tree, associated file system, network activity.",Unknown,CredentialsFromPasswordStores,"Gain Access","1698429517.0","attacker_methodology","Attacker Methodology",70,True,"Credential Access","Credentials from Password Stores"
10463,"An attempt was made to load a driver deemed to be malicious. A malicious driver could be used to subvert security controls or operating system processes. Review any binaries involved as they might be related.",Unknown,RootkitLoaded,"Keep Access","1698429517.0","attacker_methodology","Attacker Methodology",70,True,"Defense Evasion",Rootkit
10464,"An attempt was made to modify security controls or policies. An adversary may be attempting to undermine trust controls of the operating system or security products. Review the process tree.",Unknown,GenericSubvertTrustControls,"Keep Access","1698429517.0","attacker_methodology","Attacker Methodology",70,True,"Defense Evasion","Subvert Trust Controls"
10465,"A driver performed some activity which was deemed suspicious. A malicious driver could be used to subvert security controls or operating system processes. Review any binaries involved as they might be related to malware.",Unknown,RootkitActivity,"Keep Access","1698429517.0","attacker_methodology","Attacker Methodology",70,True,"Defense Evasion",Rootkit
10466,"A process attempted to send obfuscated data, possibly to a command and control server. Adversaries can use this to blend in with normal network traffic and evade detection. Review the process tree.",Unknown,DataEncodingC2Communication,"Contact Controlled Systems","1698429517.0","attacker_methodology","Attacker Methodology",70,True,"Command and Control","Data Encoding"
10467,"A process has engaged in suspicious activity indicative of Active Directory reconnaissance. Adversaries may attempt to find domain-level groups and permission settings. This information can be used to determine users with elevated permissions or attack paths through the network. Review the process tree.",Unknown,ReconActiveDirectory,Explore,"1698430764.0","attacker_methodology","Attacker Methodology",50,True,Discovery,"Domain Groups"
10468,"A process attempted to create a named pipe, possibly to facilitate lateral movement. Adversaries can use this to laterally move in a network or escalate privileges. Review the process tree.",Unknown,SuspiciousNamedPipeCreated,Explore,"1698430764.0","attacker_methodology","Attacker Methodology",70,True,"Lateral Movement","Remote Services"
10469,"A suspicious process identified by CrowdStrike was executed.",Unknown,,,"1698430764.0","suspicious_activity","Suspicious activity",70,False,"Falcon Overwatch",
10470,"A suspicious process identified by CrowdStrike was executed.",Unknown,,,"1698430764.0","suspicious_activity","Suspicious activity",70,False,"Falcon Overwatch",
10471,"A suspicious process identified by CrowdStrike was executed.",Unknown,,,"1698430764.0","suspicious_activity","Suspicious activity",70,False,"Falcon Overwatch",
10472,"A process unexpectedly loaded a driver with known vulnerabilities. Investigate the process tree.",Unknown,VulnerableDriverLoadedMedium,"Keep Access","1698429517.0","evade_detection","Evade Detection",50,True,"Defense Evasion","Disable or Modify Tools"
10473,"A suspicious Python process launched that might be related to malicious activity. Review the process tree and any related activity.",Unknown,GenericPythonExecution,"Follow Through","1698429517.0","attacker_methodology","Attacker Methodology",70,True,Execution,"Command and Scripting Interpreter"
10474,"A process wrote a document containing a suspicious macro. This can be indicative of malware attempting to establish persistence via macro. Investigate the file for unexpected macro content.",Unknown,MaliciousMacroWrite,"Follow Through","1698429517.0","attacker_methodology","Attacker Methodology",70,True,Execution,"Command and Scripting Interpreter"
10475,"A process attempted to perform a file system operation in a protected Falcon folder location. Investigate the file system operation and process tree.",Unknown,FileSystemTamperFalconFolderFileOperation,"Keep Access","1698429517.0","suspicious_activity","Suspicious activity",70,True,"Defense Evasion","Disable or Modify Tools"
10476,"A process gathered information about one or more system users by calling the 'GetUserName' API. Adversaries can use this to guide future behaviors. Review the process tree.",Unknown,GenericSystemOwnerUserDiscoveryViaGetUserNameAPI,Explore,"1698429517.0","attacker_methodology","Attacker Methodology",70,True,Discovery,"System Owner/User Discovery"
10477,"A process gathered information about other processes by calling the 'CreateToolhelp32Snapshot' API. Adversaries can use this to guide future behaviors. Review the process tree.",Unknown,ProcessDiscoveryViaCreateToolhelp32SnapshotAPI,Explore,"1698430764.0","attacker_methodology","Attacker Methodology",70,True,Discovery,"Process Discovery"
10478,"A process listed information about a file or directory by calling the 'FindFirstFile' or 'FindNextFile' API. Adversaries can use this to locate key data or assets within a file system to help gather or steal data. Review the process tree.",Unknown,GenericFileAndDirectoryDiscoveryViaFindNextFile,Explore,"1698430764.0","attacker_methodology","Attacker Methodology",70,True,Discovery,"File and Directory Discovery"
10479,"A user has executed suspicious commands under Falcon Real Time Response. These commands may be part of legitimate security operations or indicate a possible compromised Falcon account. Check the commands are expected and the user access is secured.",Unknown,"Suspicious Real Time Response commands","Keep Access","1698430764.0","suspicious_activity","Suspicious activity",80,True,Persistence,"Valid Accounts"
10480,"Reserved for future OFP use.",Unknown,,,"1698430764.0","suspicious_activity","Suspicious activity",70,False,,
10481,"Reserved for future OFP use.",Unknown,,,"1698430764.0","suspicious_activity","Suspicious activity",70,False,,
10482,"Reserved for future OFP use.",Unknown,,,"1698429517.0","suspicious_activity","Suspicious activity",70,False,,
10483,"Reserved for future OFP use.",Unknown,,,"1698429517.0","suspicious_activity","Suspicious activity",70,False,,
10484,"Reserved for future OFP use.",Unknown,,,"1698429517.0","suspicious_activity","Suspicious activity",70,False,,
10485,"Reserved for future OFP use.",Unknown,,,"1698429517.0","suspicious_activity","Suspicious activity",70,False,,
10486,"Reserved for future OFP use.",Unknown,,,"1698430764.0","suspicious_activity","Suspicious activity",70,False,,
10487,"Reserved for future OFP use.",Unknown,,,"1698430764.0","suspicious_activity","Suspicious activity",70,False,,
10488,"Reserved for future OFP use.",Unknown,,,"1698430764.0","suspicious_activity","Suspicious activity",70,False,,
10489,"Reserved for future OFP use.",Unknown,,,"1698430764.0","suspicious_activity","Suspicious activity",70,False,,
10490,"Reserved for future OFP use.",Unknown,,,"1698429517.0","suspicious_activity","Suspicious activity",70,False,,
10491,"Reserved for future OFP use.",Unknown,,,"1698429517.0","suspicious_activity","Suspicious activity",70,False,,
10492,"Reserved for future OFP use.",Unknown,,,"1698429517.0","suspicious_activity","Suspicious activity",70,False,,
10493,"Reserved for future OFP use.",Unknown,,,"1698430764.0","suspicious_activity","Suspicious activity",70,False,,
10494,"Reserved for future OFP use.",Unknown,,,"1698429517.0","suspicious_activity","Suspicious activity",70,False,,
10495,"Reserved for future OFP use.",Unknown,,,"1698430764.0","suspicious_activity","Suspicious activity",70,False,,
10496,"Reserved for future OFP use.",Unknown,,,"1698429517.0","suspicious_activity","Suspicious activity",70,False,,
10497,"Reserved for future OFP use.",Unknown,,,"1698430764.0","suspicious_activity","Suspicious activity",70,False,,
10498,"Reserved for future OFP use.",Unknown,,,"1698429517.0","suspicious_activity","Suspicious activity",70,False,,
10499,"A process appears to be loading libraries associated with crytographic functions, which might be indicative of ransomware activity. Review the process tree.",Unknown,SensorOnlyCryptDllLoaded,"Follow Through","1698430764.0","suspicious_activity","Suspicious activity",70,False,Execution,"Shared Modules"
10500,"A process copied a suspicious file to the startup folder that might indicate a malicious persistence mechanism. Investigate the process tree and the file dropped.",Unknown,StartupFolderPersistence,"Keep Access","1698429517.0","establish_persistence","Establish Persistence",70,True,Persistence,"Boot or Logon Autostart Execution"
10501,"A suspicious LNK file was executed. Adversaries may lure users into executing malicious LNK files by disguising them as innocuous documents. Review the process tree and the LNK file.",Exploitation,SuspiciousLinkFileExecuted,"Follow Through","1698430764.0","malicious_document","Malicious document",70,True,Execution,"User Execution"
10502,"A suspicious process queried for a specific registry value. This may indicate an attempt to identify specific system settings or find credentials.",Unknown,"Registry Discovery",Explore,"1698429517.0","suspicious_activity","Suspicious activity",70,False,Discovery,"Query Registry"
10503,"Reserved for future OFP use.",Unknown,,,"1698430764.0","suspicious_activity","Suspicious activity",70,False,,
10504,"Suspicious Desired State Configuration (DSC) activity has been observed. These commands may be part of legitimate operations or indicate a possible usage of DSC for lateral movement. Check that the commands and the DSC activity are expected.",Unknown,"Suspicious Desired State Configuration Activity",Explore,"1698430764.0","suspicious_activity","Suspicious activity",80,True,"Lateral Movement","Lateral Tool Transfer"
10505,"A process appears to be dumping memory. Adversaries can recover credentials from memory dumps. Incident Responders also use memory dumps for their investigations. If this is unexpected, review the process tree.","Lateral motion",MemoryDumpingTool,"Gain Access","1698430764.0","credential_theft","Credential theft",70,True,"Credential Access","OS Credential Dumping"
10506,"A process attempted to shutdown or reboot the host. Adversaries may shutdown or reboot systems to interrupt access to, or aid in the destruction of, those systems. Investigate for further signs of compromise.",Unknown,SuspiciousShutdownWin,"Follow Through","1698429517.0","attacker_methodology","Attacker Methodology",70,True,Impact,"System Shutdown/Reboot"
10507,"A system routine has been invoked from a user-mode thread with a PreviousMode value mismatch. This activity is often associated with local escalation of privilege techniques. Please check the process tree and surrounding events to determine if this activity was expected.",Unknown,PreviousModeCorrupted,"Gain Access","1698430764.0","suspicious_activity","Suspicious activity",80,True,"Privilege Escalation","Exploitation for Privilege Escalation"
10508,"A process made a suspicious IO control request to a loaded vulnerable driver. These requests can be attempts to terminate privileged processes, perform credential dumping, escalate privileges, or perform malicious actions in kernel memory. Check the requesting process and the driver to verify this is expected.",Unknown,IOCTLBlockVulnDriver,"Keep Access","1698429517.0","suspicious_activity","Suspicious activity",70,True,"Defense Evasion","Disable or Modify Tools"
10997,"Experimental detection.",Unknown,WinExperimental2,"Falcon Detection Method","1698429517.0","known_malware","Known malware",10,False,"Falcon Overwatch","Malicious Activity"
10998,"Experimental detection.",Unknown,WinExperimental3,"Falcon Detection Method","1698429517.0","known_malware","Known malware",10,False,"Falcon Overwatch","Malicious Activity"
10999,"Experimental detection.",Unknown,WinExperimental4,"Falcon Detection Method","1698430764.0","known_malware","Known malware",10,False,"Falcon Overwatch","Malicious Activity"
20100,"A suspicious process identified by CrowdStrike was executed.",Unknown,ExperimentalIndicatorMac,"Falcon Detection Method","1698429517.0","suspicious_activity","Suspicious activity",50,False,"Falcon Overwatch","Suspicious Activity"
20101,"A suspicious process identified by CrowdStrike was executed.",Unknown,ExperimentalIndicatorMac2,"Falcon Detection Method","1698430764.0","suspicious_activity","Suspicious activity",50,False,"Falcon Overwatch","Suspicious Activity"
20102,"A process appears to be accessing credentials, likely in an attempt to steal passwords. If the activity is not sanctioned, your credentials may have been compromised.","Lateral motion",CredentialAccessMac,"Gain Access","1698430764.0","credential_theft","Credential theft",70,True,"Credential Access","OS Credential Dumping"
20103,"The activity appears to be related to a privilege escalation attempt. An adversary may execute additional malicious commands if the escalation was successful.",Unknown,PrivilegeEscalationMac,"Gain Access","1698430764.0","authentication_bypass","Authentication Bypass",70,True,"Privilege Escalation","Exploitation for Privilege Escalation"
20104,"The activity appears to be related to an adversary establishing persistence. The host may already be compromised and the activity should be investigated further to find the source.",Unknown,PersistenceMac,"Keep Access","1698429517.0","establish_persistence","Establish Persistence",70,True,Persistence,"External Remote Services"
20105,"An adversary appears to have attempted to exploit a vulnerability in this process. Look for follow-on activity that may indicate further malicious behaviors.",Unknown,DefenseEvasionMac,"Follow Through","1698429517.0","evade_detection","Evade Detection",70,True,Execution,"Exploitation for Client Execution"
20106,"The process appears to be involved in reconnaissance activity. Review the activity to determine if it is expected in your environment.",Unknown,DiscoveryMac,Explore,"1698429517.0","attacker_methodology","Attacker Methodology",70,True,Discovery,"System Information Discovery"
20107,"A process appears to have been exploited to facilitate lateral movement between hosts in the environment. Both hosts should be investigated for further signs of compromise.",Unknown,LateralMovementMac,Explore,"1698429517.0","establish_persistence","Establish Persistence",70,True,"Lateral Movement","Exploitation of Remote Services"
